collectID,collectName
1,辽白釉剔划牡丹纹盘口长颈瓶
2,辽绿釉贴团龙菊花纹双孔鸡冠壶
3,白瓷横梁鸡冠壶
4,辽黄釉划弦纹凤首瓶
5,辽黄釉葫芦形执壶
6,辽绿釉凤首瓶
7,辽三彩釉印花八卦纹执壶
8,清雍正铜胎画珐琅黄地牡丹纹双连盖盒
9,元青花松竹梅纹八棱罐
10,元青花缠枝牡丹纹盖罐
11,青花缠枝灵芝纹高足杯
12,青花双鸾纹高足杯
13,元青花云龙纹高足杯
14,元青花云龙纹高足杯
15,元青花折枝栀子花纹梨形壶
16,元青花十字杵纹盘
17,清黑漆螺钿游春图帽盒
18,清乾隆黄地青花云龙纹螭耳扁壶
19,清嘉庆粉彩莲花寿字纹瓶
20,钧窑窑变釉铺首衔环三足炉
21,雷乳纹方鼎
22,西周“圉”铜簋
23,西周“鱼”铭铜尊
24,西周卷体夔纹蟠龙盖罍
25,西周“伯矩”甗
26,西周“史伐”卣
27,西周“登屰”方罍
28,西周宽带纹贯耳壶
29,北宋“上京”款大晟南吕编钟
30,商“大祖日己”戈
31,商“祖日乙”戈
32,商“大兄日乙”戈
33,清乾隆粉彩百花尊
34,现代齐白石灯鼠立轴
35,现代反黄彫番莲五角立筋盖盒
36,现代王雪涛花三鸡图轴
37,现代钱君匋行书七绝诗轴
38,现代许滌新书毛泽东诗轴
39,现代陆俨少水墨山水轴
40,现代冕少翔双寿图轴
41,现代陈半丁行书毛泽东“冬雪”轴
42,现代罗惇曧行书联
43,现代立筋方盖盒
44,现代溥雪斋行书节月赋轴
45,现代曹靖华书鲁迅诗轴
46,现代陆俨少设色江寺图轴
47,现代杨德衡设色鸣雪图轴
48,现代陈半丁行书毛泽东“为女民兵题照”轴
49,现代反黄刻关云长千里走单骑小围屏
50,现代顿立夫篆书杜甫诗句轴
51,现代姚雪垠行书七言诗二首立轴
52,现代陆俨少设色山水轴
53,现代季观之镜泊飞瀑横幅
54,现代陈半丁行书毛泽东“六盘山”轴
55,现代反黄刻山水提箱
56,现代潘伯鹰行书叙兰亭刻本源流轴
57,现代臧克家行书毛主席诗词《卜算子咏梅》立轴
58,现代朱屺瞻兰花图轴
59,现代钟质夫等合作长松集翠图轴
60,现代丰子恺行书毛泽东“卜算子.咏梅”轴
61,现代反黄刻白猿八稜果盘
62,现代臧克家行书七言诗立轴
63,现代朱屺瞻设色藤萝图轴
64,现代丰子恺行书毛泽东“六盘山”轴
65,现代反黄浅刻毛主席像
66,现代周士观草书毛主席诗词《水调歌头重上井岗山》、《念奴娇鸟儿问答》二首立轴
67,现代费新我行书毛泽东“昆仑”轴
68,现代反黄刻山水花鸟六稜瓶
69,现代周士观草书毛主席诗词《水调歌头重上井岗山》一首立轴
70,现代程十发设色人物轴
71,现代王个簃篆书毛泽东“黄鹤楼”轴
72,民国颜伯龙美人蕉猫石图轴
73,现代周士观草书临怀素《送酒帖》立轴
74,现代宋文治设色山水
75,现代谢稚柳行书毛泽东“昆仑”轴
76,现代周士观草书临怀素自叙一节立轴
77,现代白雪石设色山水
78,现代叶恭绰行书毛泽东“沁园春雪”轴
79,现代丰子恺春日游图轴
80,现代杨之光首都儿童看电视图轴
81,现代周士观草书临书谱一节横幅
82,现代宋吟可设色人物
83,现代叶恭绰行书毛泽东“蝶恋花”横幅
84,现代萧俊贤陈年合作梅花图轴
85,现代李苦禅葡萄公鸡立幅
86,现代李苦禅花鸟册
87,现代罗复堪鞠部杂谈手稿卷
88,现代周士观草书为新会废物利用展览馆题七言诗二首立轴
89,现代关良设色孙悟空轴
90,现代叶恭绰行书毛泽东“井冈山”轴
91,现代赵少昂花鸟图轴
92,现代周铁衡设色花鸟图轴
93,现代周士观草书轴
94,现代李苦禅水墨兰雀图横幅
95,现代叶恭绰行书毛泽东“北戴河”轴
96,现代李可染山水图轴
97,现代王传涛山水立幅
98,现代康生书札页
99,现代周士观篆书轴
100,现代宋振庭设色花卉
101,现代叶恭绰行书毛泽东“大拍地”轴
102,现代曹克家耄耋图轴
103,现代徐悲鸿飞鹰图轴
104,现代李智超青绿山水立幅
105,现代黄宾虹水鸟图轴
106,现代王个簃设色花卉图轴
107,现代夏承焘行书毛主席诗词《浣溪沙和柳亚子先生》立轴
108,现代叶恭绰行书毛泽东“长征”轴
109,现代谢稚柳竹蝶红叶图轴
110,现代仿王震人物图轴
111,现代王华南雪景山水轴
112,现代齐白石葡萄图轴
113,现代郁文华设色花鸟图轴
114,现代夏承焘行书毛主席诗词《七绝为女民兵题照》立轴
115,现代叶恭绰行书毛泽东“昆仑”横幅
116,现代潘天寿鸟石图镜心
117,现代摹辽阳北园汉墓车骑图壁画
118,现代刘旦宅新娘子出工图轴
119,现代周怀民十三陵水库图横幅
120,现代马公愚菊花枇杷图轴
121,现代夏承焘行书七言诗横幅
122,现代叶恭绰行书毛泽东“重阳”轴
123,现代黄胄雏鸡图镜心
124,现代王叔晖晴雯补裘图轴
125,现代齐子如临八大山人花鸟册
126,现代周怀民十三陵水库工地图轴
127,现代夏承焘行书七言春工诗一首立幅
128,现代叶恭绰行书毛泽东“会昌”轴
129,现代娄师白马耀华合作和平鸽图轴
130,现代齐白石文具遗物
131,现代周怀民密云水库工地图横幅
132,现代夏承焘行书词一首横幅
133,现代溥行书七言联
134,现代叶恭绰行书毛泽东“黄鹤楼”轴
135,现代掐丝珐琅北京名胜瓶
136,现代陆鸿年夕阳图轴
137,现代寿山石雕儿童与和平鸽
138,现代周怀民青铜峡工地图横幅
139,现代夏承焘行书天安门国庆观礼作好事近词立轴
140,现代王曼如指画松树轴
141,现代叶恭绰行书毛泽东“六盘山”轴
142,现刘单庵香笔画册
143,现代掐丝珐琅凫雁蒜头瓶
144,现代颜地漓江写生山水立幅
145,现代寿山石雕子母羊
146,现代门神灶王印板
147,现代乔木石榴小鸟图轴
148,现代叶圣陶楷书浣溪沙二首立轴
149,现代车向忱颂高其佩画展行书联
150,现代叶恭绰行书毛泽东“游泳”横幅
151,现代颜地漓江写生山水立幅
152,现代寿山石彫鹅
153,现代纸牌、骰子
154,现代叶圣陶篆书毛主席诗词《采桑子重阳》轴
155,现代叶恭绰行书毛泽东“从汀州向长沙”横幅
156,现代马一浮行书谢诸友诗轴
157,现代萨镇冰楷书轴
158,现代黄胄收获图轴
159,现代景德镇窑彩釉紫鹃送茶瓷塑
160,现代萨满神鼓
161,现代叶圣陶篆书集陶谢句五言联
162,现代叶恭绰行书毛泽东“蒋桂战争”轴
163,现代马衡隶书轴
164,现代剔红牡丹长方盒
165,现代广绣牡丹孔雀立轴
166,现代于立群篆书毛主席诗词《沁园春雪》立轴
167,现代叶恭绰行书毛泽东“娄山关”轴
168,现代高二适行草书七言唐诗轴
169,现代摹辽阳三道壕第一号壁画墓壁画
170,现代剔红牡丹纹漆瓶
171,现代炼钢防热服
172,现代于立群楷书“你办事，我放心”横幅
173,现代叶恭绰行书毛泽东“元旦”轴
174,现代于非厂设色玉兰成扇
175,现代俞陛云设色山水折扇
176,现代沈尹默行书高尔基忆列宁语轴
177,现代陈林斋、孙天牧合作摹唐宋元画页
178,现代剔红牡丹纹漆瓶
179,现代木斗、木升
180,现代齐燕铭行书毛主席语录立轴
181,现代叶恭绰行书毛泽东“广昌路上”轴
182,现代溥佐设色骑马人物成扇
183,现代剔红菊花纹瓜式漆盒
184,现代155公里榴弹炮弹
185,现代葫芦形点种器
186,现代沈雁冰行书毛主席诗词《水调歌头重上井岗山》立轴
187,现代王方宇章草书急就章镜心(朱书)
188,现代马晋设色奔马图成扇
189,现代陈叔通行书诗轴
190,现代剔红牡丹纹圆漆盒
191,现代时间引信
192,现代坩埚
193,现代沈雁冰行书《满江红》词立轴
194,现代叶恭绰行书毛泽东“送瘟神”卷
195,现代陈半丁设色杜鹃成扇
196,现代嵌锡片车马纹绿漆瓶
197,现代引信
198,现代大杆称
199,现代沈雁冰行书学习毛主席词二首后感赋立轴
200,现代叶恭绰行书毛泽东渔家傲卷
201,现代周元亮设色“烟峦雨霁”成扇
202,现代李长志卉册
203,现代嵌锡填彩花卉纹黑漆瓶
204,现代弹底引信
205,现代铁锄、铁镐、铁镰
206,现代徐悲鸿行书轴
207,现代赵朴初行书七言诗立轴
208,现代章士钊行书毛泽东诗词集卷
209,现代萧愻水墨山水成扇
210,现代金梁金文书轴
211,现代堆云龙纹绿漆烟具
212,现代碎弹片
213,现代铁锄
214,现代邱绶臣枇杷小鸟图轴
215,现代陈大羽设色雄鸡立轴
216,现代石鲁浅设色山水图轴
217,现代于立群楷书毛泽东七律轴
218,现代日人涉山花卉轴
219,现代溥佺等合作画轴
220,嵌锡条花卉纹黄漆盖罐
221,现代木犁
222,现代陈大羽设色紫藤立轴
223,现代臧克家行书毛泽东“咏梅”轴
224,现代仿康有为行书轴
225,现代堆花绿漆盖罐
226,现代铁锹
227,现代叶丰枇杷蝴蝶图轴
228,现代陈大羽设色萄蟹立轴
229,现代陈毅致王世民信页
230,现代周建人行书毛泽东“反第二次围剿”轴
231,现代潘龄皋行书轴
232,现代彩绘蝴蝶纹黑漆盘
233,现代齐白石桃实图轴
234,现代朱屺瞻渔舟待潮图轴
235,现代陈大羽设色荷花立轴
236,现代亚明芦塘孤舟图轴
237,现代陈叔通楷书毛泽东“元旦”轴
238,现代王妙如山水轴
239,现代嵌蛋壳梅花纹黑漆盘
240,现代张聿光设色花鸟图轴
241,现代陈佩秋设色花鸟立轴
242,现代陈叔通楷书毛泽东“广昌路上”轴
243,现代陈之佛芙蓉双鸟图轴
244,现代嵌锡片花卉纹黑漆盘
245,现代地契
246,现代徐悲鸿垂柳四鹊图轴
247,现代谢稚柳设色松树立轴
248,现代邓初民行书毛泽东“为女民兵题照”轴
249,现代陈之佛寒天野鸟图轴
250,现代彩绘花卉纹黑漆圆盒
251,现代叶丰设色花卉图轴
252,现代柳村设色枇杷立轴
253,现代齐良巳设色东方朔图轴
254,现代许德珩行书毛泽东七律轴
255,现代宋惠民油画阳光下的恋情
256,现代嵌锡片花卉纹黑漆高足罐
257,现代沈迈士设色枇杷图轴
258,现代叶浅予设色西藏高原之舞图轴
259,现代何水法设色荷花立轴
260,现代叶圣陶行书毛泽东“沁园春雪”轴
261,任梦璋油画福陵雪
262,现代胭脂红漆荷花式盒
263,现代何水法设色凌霄花立轴
264,现代潘天寿行书毛泽东诗词卷
265,伏拉基米尔油画“贝加尔湖”
266,现代宋光葆花鸟册
267,现代嵌锡片花蝶纹胭脂红漆瓶
268,现代何水法设色牡丹立轴
269,现代于立群行书毛泽东“冬雪”轴
270,库兹米娜油画“伊尔库兹克街道”
271,现代仿木纹漆瓶
272,现代半脱胎釉下彩牵牛花瓷酒具
273,现代何水法设色花卉立轴
274,现代陈年设色菊花图轴
275,现代田汉草书毛泽东“和柳亚子先生”轴
276,库兹米尔油画伊利娜
277,现代仿木纹漆罐
278,现代粉釉描金花朵花式瓷咖啡具
279,现代应野平云山烟树横幅
280,现代诸乐三设色紫藤立轴
281,现代田汉草书毛泽东“和郭沫若同志”轴
282,现代田野油画
283,现代林凤眠菊花图轴
284,现代嵌银丝花卉纹黑漆长方盒
285,现代天青地堆云鹤瓷茶具
286,现代陆小曼渔人晚息图轴
287,现代沙孟海草书毛主席诗词《十六字令》立轴
288,现代老舍行书毛泽东“会昌”轴
289,现代徐悲鸿等合作墨竹图轴
290,现代嵌银丝双燕花卉纹红木方盒
291,现代浮彫楼阁人物方砖
292,现代关山月岭南农村图轴
293,现代沙孟沙海草书古诗立轴
294,现代严济慈行书毛泽东“到韶山”立轴
295,现代王青芳鲤鱼图轴
296,现代嵌金银丝荷花芦雁纹红木盒
297,现代拱德邻行书七绝诗轴
298,现代沙孟海草书叶剑英五言诗立轴
299,现代严济慈行书毛泽东“清平乐 会昌”立轴
300,现代齐白石螃蟹图轴
301,现代徐燕荪运甓轴
302,现代嵌金银丝狮球纹红木盒
303,现代黄西爽行书杜诗轴
304,现代娄师白花鸟图轴
305,现代陆维钊录书“世上无难事只要肯登攀”轴
306,现代于立群行书毛泽东“答友人”轴
307,现代刘咸荣行书轴
308,现代蒋兆和人物轴
309,现代湘绣韶山毛泽东同志故居横幅
310,现代赵冷月隶书毛主席《七律吊罗荣桓同志》立轴
311,现代于立群隶书毛泽东“咏梅”轴
312,现代汪慎生玫瑰双鸽图轴
313,现代湘绣齐白石画葡萄立幅
314,现代赵冷月行书叶副主席七言诗立轴
315,现代朱光行书毛泽东“人民解放军占领南京”立轴
316,现代湘绣丝瓜飞鸟立幅
317,现代单晓天隶书七言联
318,现代沈定庵行书苏轼承天寺记轴
319,现代朱光行书毛泽东“六盘山”立轴
320,现代陈年花卉图轴
321,现代戳纱博古花果立幅
322,现代齐白石荔枝墨鸽图轴
323,现代单晓天隶书朱德七言诗立轴
324,现代沈定庵草书轴
325,现代华罗庚行书毛泽东“到韶山”立轴
326,现代陈年诸家山水轴
327,现代黄缎网扣花卉台布
328,现代齐白石岑课子图图轴
329,现代单晓天篆书叶副主席诗立轴
330,现代吕迈篆书五言诗联
331,现代于非闇行书毛泽东长征诗轴
332,现代朱学范行书毛泽东“为女民兵题照”立轴
333,现代湘绣花蝶床单
334,现代单晓天隶书周总理诗轴
335,现代吕迈大年图轴
336,现代邵力子行书毛泽东“到韶山”立轴
337,现代沈枢小楷离骚轴
338,现代张泽画虎轴
339,现代缂丝石榴、蔷薇、白头翁立幅
340,现代谢稚柳花卉草虫图轴
341,现代单晓天草书毛主席诗词《清平乐》立轴
342,现代余明行书七言诗轴
343,现代吴作人草书毛泽东“和柳亚子”立轴
344,现代苏绣齐白石画棕树小鸡插屏
345,现代单晓天隶书齐燕铭《清平乐登临江楼》立轴
346,现代余明行草书七绝诗轴
347,现代李苦禅行书毛泽东十六字令立轴
348,现代周肇祥江行小景图轴
349,现代两面绣春柳猫蝶插屏
350,现代魏紫熙设色山水立轴
351,现代朱屺瞻行书毛泽东“和柳亚子”立轴
352,现代徐悲鸿画马图横幅
353,现代两面绣花卉小猫插屏
354,现代魏紫熙水墨谈彩唐人句诗意画
355,现代朱学范行书毛泽东“为女民兵题照”立轴
356,现代湘绣花鸟立幅
357,现代应野平设色云壑长松立轴
358,现代冯忠莲设色采芝图轴
359,现代朱学范行书毛泽东“大拍地”立轴
360,现代苏绣齐白石花卉草虫立幅
361,现代雕菊花和平鸽
362,现代宁斧成指画大好河山轴
363,现代李德全楷书毛泽东“为女民兵题照”立轴
364,现代寿山石雕子母猪
365,现代透雕虾蟹竹篓木摆件
366,现代张爱萍行书毛泽东题句立轴
367,现代王造时行书轴
368,现代煤精雕矿工
369,现代木雕荔枝
370,现代周信芳行书毛泽东“和郭沫若同志”立轴
371,现代刻绘水墨花鸟纹瓷瓶
372,现代铸造工人漆像
373,现代李可染牧童游戏图轴
374,现代陈其尤行书毛泽东“庐山仙人洞题照”轴
375,现代白釉狮子形瓷塑
376,现代漆民兵像
377,现代齐白石设色桃实灵芝图轴
378,现代李苦禅荷花图轴
379,现代巴金行书毛泽东“郭沫若同志”轴
380,现代徐济八破图轴
381,现代德化窑素烧苏武牧羊白瓷塑
382,现代立筋回纹雕兰竹插屏
383,现代齐白石雄鸡鸡雏图轴
384,现代李可染牧童牛背吹笛图轴
385,现代谭泽闿行书荆公诗立轴
386,现代郭凤惠行书毛泽东“答友人”扇面
387,现代白釉刻花番莲纹瓷胆瓶
388,现代立筋扇形插屏
389,现代齐子如蜜蜂花卉图轴
390,现代齐白石杂画册
391,现代溥雪斋行书毛泽东“反第二次大围剿”扇面
392,现代白釉黑花双凤纹瓷瓶
393,现代立筋木雕花薰炉
394,现代张珩行书米芾苕溪诗轴
395,现代画家集锦册
396,清张四教里堂行乐图轴
397,现代溥雪斋行书毛泽东“登庐山”扇面
398,现代磁州窑黑白釉刻划花卉纹小瓷瓶
399,现代版画
400,现代齐白石信札册
401,清关槐仿古山水兔图册
402,现代王已干山色有无中图轴
403,现代溥雪斋行书毛泽东“到韶山”扇面
404,现代磁州窑白、褐釉剔地刻划花草纹瓷瓶
405,现代版画
406,现代朱光行草书自作迎春诗轴
407,现代陆维钊信札页
408,现代许以栗行书毛泽东“咏梅”扇面
409,现代黑、白釉剔地花草纹瓷梅瓶
410,现代版画
411,现代董希文油画长城图
412,现代赵孟朱蜻蜓荷花图轴
413,现代王方宇隶书饮且食寿而康联
414,现代周承忠楷书毛泽东诗词扇面
415,现代磁州窑白釉黑花刻划牡丹花卉纹瓷梅瓶
416,现代版画
417,现代董希文油画三峡图
418,现代赵孟朱设色蟠桃菊花图轴
419,现代简为任楷书毛泽东诗扇面
420,现代白釉刻划花卉纹瓷瓶
421,现代版画
422,现代赵孟朱巴蕉芍药图轴
423,现代褚保友行书毛泽东“人民解放军占领南京”扇面
424,现代磁州窑白釉划牡丹花纹四足瓷水仙盆
425,现代版画
426,现代汪慎生竹鸡轴
427,现代赵孟朱月季麻雀图轴
428,现代杨钧世楷书毛泽东诗扇面
429,现代磁州窑白釉黑花牡丹纹瓷水仙盆
430,现代版画
431,现代黄宾虹抢风过太湖图轴
432,现代单晓天楷书毛泽东诗词扇面
433,现代磁州窑黄釉黑花雕牡丹纹瓷盖罐
434,现代版画
435,现代齐白石水墨鱼蟹图轴
436,现代杜襄篆书毛泽东“人民解放军占领南京”扇面
437,现代褐釉雕兔纹陶盖罐
438,现代版画
439,现代赵孟朱猿猴图轴
440,现代钱君陶隶书毛泽东诗扇面
441,现代谢无量行书轴
442,现代黄釉雕六鱼纹泡菜陶坛
443,现代版画“厦门支前图卷”
444,现代任率英仙女散花图轴
445,现代吴镜汀行书毛泽东词扇面
446,现代褐釉回纹小泡菜陶坛
447,现代将兆和读宪法人物图轴
448,现代归质忱楷书毛泽东诗扇面
449,现代黄釉雕菊花纹陶盖罐
450,现代陆定一行书红军东征歌横幅
451,现代秦仲文行书毛泽东登庐山扇面
452,现代雕牡丹琥珀饰件
453,现代张东荪行书轴
454,现代黄釉雕白菜叶陶壁挂
455,现代张凭忽报人间曾伏虎图轴
456,现代赵孟朱花鸟图册
457,现代陈漱石篆书毛泽东“大拍地”扇面
458,现代雕莲纹琥珀饰件
459,现代吴幻荪川江风景图轴
460,现代黑釉陶把壶
461,现代居陶印选
462,现代何香凝犹有花枝俏图轴
463,现代齐白石行书对联
464,现代赵孟朱三羊图轴
465,现代樊瑞贞隶书毛泽东“答友人”扇面
466,现代褐釉塑贴花鸟高足陶盖罐
467,现代长征印谱
468,现代康巽报春图轴
469,现代齐白石花卉册
470,现代龚继先绘雄鹰图轴
471,现代郭盦楷书毛泽东诗词扇面
472,现代胡佩衡秋山观瀑图轴
473,现代黄褐釉雕花有盖小陶把壶
474,现代关山月万马战猶酣图轴
475,现代赵孟朱桃花横幅
476,现代彭八百行书毛泽东“游泳”扇面
477,现代黄釉荷叶花式口带托盘花盆
478,现代傅抱石芙蓉国里尽朝晖图轴
479,现代于非闇设色梅竹鹧横幅
480,现代童雪鸿行书毛泽东“游泳”扇面
481,现代有盖黄褐釉雕花陶茶壶
482,现代杨之光画女民兵图轴
483,现代齐子如花卉草虫图册
484,现代囗涌先行书毛泽东“和郭沫若”同志扇面
485,现代柳亚子行书轴
486,现代黄釉雕花双耳陶盖罐
487,现代陈维信万山红遍层林尽染图轴
488,现代卲宇儿童图轴
489,现代那君易篆书毛泽东诗扇面
490,现代吴佩孚行书五言诗轴
491,现代吕凤子夏山图轴
492,现代黄褐釉几何纹陶盖罐
493,现代钱松喦画神女应无恙当驚世界殊图轴
494,现代宁斧成设色蔬果图轴
495,现代黄洁楷书毛泽东七律扇面
496,现代黄褐釉雕花高足陶盖罐
497,现代齐白石游虾图轴
498,现代王信画众志成城图横幅
499,现代宁斧成山水图轴
500,现代奉南行书毛泽东“和郭沫若同志”扇面
501,现代褐釉小陶把壶
502,现代岺学恭大渡桥横铁索寒图轴
503,现代邹雅山水图轴
504,现代萧伯囗行书毛泽东诗扇面
505,现代黄釉雕花陶盖罐
506,现代周怀民一桥飞架南北天堑变通途图轴
507,现代邹雅山水图轴
508,现代囗琼楷书毛泽东诗词扇面
509,现代何香凝古干清标图轴
510,现代褐釉划花小陶盖罐
511,现代宋文治漫江碧透百舸争流图轴
512,现代王堃聘行书毛泽东语录轴
513,现代孙鸿雪行书毛泽东“和柳亚子先生”扇面
514,现代褐釉双耳盖陶碗
515,现代朱德行书题词轴
516,现代陶一清画三军过后尽开颜图轴
517,现代马学礼刻捷报频传版画横幅
518,现代张宗祥行书李白七律诗轴
519,现代萧劳行书毛泽东诗词扇面
520,现代吴显曾仕女图轴
521,现代景德镇窑影青釉刻花双柄瓷糖盖罐
522,现代黄子曦义和团图轴
523,现代魏紫熙画无限风光在险峰图轴
524,现代李双成马学礼刻灯光捕鱼版画横幅
525,现代潘伯鹰行书毛泽东词轴
526,现代萧劳行书毛泽东诗词扇面
527,现代陈年花卉图轴
528,现代景德镇窑影青釉刻花瓷咖啡具
529,现代齐白石南瓜图轴
530,现代宽甸火车头农业生产合作社社员劳动往来手册
531,现代李文信画女民兵图轴
532,腾敦喜刻“骗工”“狠批克己复礼”版画
533,现代王堃聘行书毛泽东浪淘沙北戴河词轴
534,现代王昆仑行书贺锦斋烈士诗立轴
535,现代景德镇窑彩釉雕木兰读书瓷塑
536,现代铁路运输转帐支票
537,现代申申画遍地英雄下文烟图轴
538,现代石景斌刻警报等版画
539,现代张珩行书五言诗轴
540,现代邓拓行书李大钊烈士诗轴
541,现代景德镇窑彩釉雕鱼樵问答瓷塑
542,现代东北银行本票票样
543,现代费新我画风捲红旗过大关图轴
544,现代钟振材刻好后勤、前面又是两户村版画
545,现代卢光照荷花鸳鸯图轴
546,现代冯友兰行书李少石烈士诗轴
547,现代吴幻荪黄均合作江天渔乐图轴
548,现代景德镇窑彩釉雕缝衣女童瓷塑
549,现代东北银行地方流通券票样
550,现代朱德委员长毛主席七律人民解放军占领南京一首诗轴
551,现代胡传治刻源源出厂、扩建版画
552,现代唐熊芭蕉翠鸟图轴
553,现代谢稚柳梅竹图轴
554,现代萧向荣行书罗学瓒烈士诗轴
555,现代孙克纲大盘道图轴
556,现代景德镇彩釉雕朝鲜族妇女瓷塑
557,现代齐白石荷花鸳鸯图轴
558,现代朱德委员长毛主席清平乐六盘山河一阙词轴
559,现代王本善刻斗争、主权版画
560,现代许麟庐群虾图轴
561,现代叶圣陶楷书杨超烈士诗轴
562,现代罗复堪草书诗轴
563,现代陈麟祥百子图立幅
564,现代景德镇窑彩釉雕宋景诗瓷塑
565,现代董必武书毛主席清平乐词会昌词轴
566,现代王兆珠刻深挖洞、矿山新机版画
567,现代唐云墨竹图轴
568,现代华罗庚行书刘振美烈士诗轴
569,现代刘子久松树图轴
570,现代景德镇窑彩釉雕李秀成瓷塑
571,现代董必武自书诗四首横幅
572,现代隋贵民刻课堂等版画
573,现代施展行书诗轴
574,现代萧三行书续范亭烈士诗立轴
575,现代血红釉兔毫斑碗
576,现代孙其峰玉兰图轴
577,现代景德镇窑彩釉雕采茶姑娘瓷塑
578,现代吴东迈篆书毛泽东清平乐六盘山词轴
579,现代刘伯承行书毛泽东卜算子词咏梅词轴
580,现代刘斌刻新粮盈仓等版画
581,现代宁斧成钟鼎文轴
582,现代吴作人书凃正坤烈士诗轴
583,现代酱釉碗
584,现代齐白石海棠图轴
585,现代李昆璞八哥图轴
586,现代景德镇窑白釉雕花卉纹母子鹿瓷塑
587,现代谢磊明篆书毛泽东七律长征诗轴
588,现代康生草书毛泽东沁园春长沙词轴
589,现代李铁亮刻学理论等版画
590,现代齐白石盘菊轴
591,现代宁斧成隶书毛泽东词轴
592,现代邵力子行书刘伯坚烈士诗立轴
593,现代窑变五棱碗
594,现代张其翼芙蓉鸳鸯图轴
595,现代景德镇窑彩釉雕宋士杰瓷塑
596,现代郭沫若草书毛泽东和郭末若同志满江红词轴
597,现代于清廉刻车间摆战场等版画
598,现代宁斧成隶书立轴
599,现代郭味蕖行书李贯慈烈士诗轴
600,现代彩釉网纹碗
601,现代章士钊临欧楷书轴
602,现代王颂馀高山瀑布图轴
603,现代景德镇窑白釉描金填彩雕兔服舞者瓷塑
604,现代徐悲鸿枇杷图轴
605,现代张宗祥行书轴
606,现代李苦禅子母鸡图轴
607,现代郭末若书毛泽东卜算子词咏梅词轴
608,现代尤德昌刻有所准备等版画
609,现代宁斧成隶书诗轴
610,现代臧克家行书续范亭烈士诗横幅
611,现代窑变彩釉碗
612,现代萧心泉海棠图轴
613,现代景德镇窑彩釉雕割稻妇女瓷塑
614,现代徐悲鸿奔马图轴
615,现代郭沫若草书毛泽东七律答友人诗轴
616,现代隋贵民尤德昌刻钢铁车间版画横幅
617,现代宁斧成隶书毛泽东诗轴
618,现代臧克家行书宣侠父烈士诗立轴
619,现代鬲状镂空炉
620,现代梁砺平芭蕉立鹤图轴
